{
  "contract": "audit-report",
  "version": 2,
  "task_id": "gpt-build-audit-pair",
  "build_revision": 0,
  "audit_round": 1,
  "verdict": "PASS",
  "summary": "The supplied GPT Build and Audit package satisfies the listed protocol and GPT-specific criteria by static inspection; no supported BLOCKER or MAJOR was found in the supplied scope.",
  "scope_review": {
    "reviewed_paths": [
      "builder-gpt.md",
      "auditor-gpt.md",
      "contract.md",
      "gpt-config.json",
      "standards.template.md",
      "prompts/kickoff.md",
      "prompts/audit-request.md",
      "prompts/rework.md",
      "prompts/escalate.md",
      "SMOKE-TEST.md",
      "schemas/",
      "tools/validate_examples.py"
    ],
    "unavailable_context": [
      "A completed project-specific standards.md",
      "A live Custom GPT instance and target-platform editor capabilities",
      "Live transcripts from the two configured GPTs"
    ]
  },
  "verification_assessment": {
    "status": "static_only",
    "note": "The retained validator passed its bundled positive and negative fixtures. The final Builder and Auditor prompts were statically traced against all supplied criteria; live Custom GPT behavior was not available and is not claimed."
  },
  "findings": [],
  "regression_check": [],
  "what_held_up": "The Builder and Auditor share an explicit v2 contract, require complete current artifact snapshots, distinguish evidence sources, preserve finding history, and stop after three audits. The GPT profile adds direct checks for capability fit, Knowledge injection, Action data flows, privacy, uncertainty, and live-verification limits. The retained validator passes the upstream examples and expected-rejection fixtures.",
  "open_questions": [
    "Fill in project-specific standards.md before using the pair on a real GPT.",
    "Exercise the actual configured GPTs on representative and adversarial inputs before release."
  ],
  "rework_brief": null,
  "escalation": null,
  "round_limit_reached": false
}
