{
  "contract": "audit-report",
  "version": 2,
  "task_id": "moving-average",
  "build_revision": 2,
  "audit_round": 3,
  "verdict": "FAIL",
  "summary": "The final revision still accepts a boolean as a window and violates the explicit input contract.",
  "scope_review": {
    "reviewed_paths": ["examples/fixtures/moving-average-rework.py"],
    "unavailable_context": []
  },
  "verification_assessment": {
    "status": "static_only",
    "note": "Only the supplied source was inspected; no project test environment was available."
  },
  "findings": [
    {
      "id": "F2",
      "severity": "MAJOR",
      "category": "correctness",
      "file": "examples/fixtures/moving-average-rework.py",
      "lines": "2-3",
      "quote": "not isinstance(window, int) or window <= 0",
      "trigger": "Call with values=[2, 4, 6] and window=True.",
      "expected": "Raise ValueError because bool is excluded from the window type contract.",
      "actual": "True passes the integer check and is treated as window 1.",
      "impact": "Invalid input is silently accepted and produces output under an unintended window.",
      "fix": "Reject bool explicitly before the integer check.",
      "evidence_basis": "static_proof",
      "evidence_detail": "In Python, bool is a subclass of int, so isinstance(True, int) is true."
    }
  ],
  "regression_check": [
    {
      "finding_id": "F2",
      "status": "open",
      "evidence": "The rework still uses an integer type check that accepts True."
    }
  ],
  "what_held_up": "The original final-window omission was fixed and remains fixed in the current source.",
  "open_questions": [],
  "rework_brief": null,
  "escalation": {
    "root_causes": ["The boolean-window validation defect remains open after the second rework."],
    "human_decision": "Decide whether to abandon the patch or authorize a fresh task to fix the remaining validation defect.",
    "cheapest_path": "Start a new task with a new task_id, carry forward the current source, and add a focused boolean-window check."
  },
  "round_limit_reached": true
}
